{
  "title": "I Would Highly Recommend Tripplankaro",
  "name": "Mr. Sagar Savsani",
  "destination": "Central Europe",
  "month_year": "Jun",
  "trip_type": "Individual Tour",
  "rating": 5,
  "review": "I would highly recommend Tripplankaro after my 10 days Europe tour of Paris and Switzerland for our Honeymoon. Everything from mountain excursions to Swiss rail passes was arranged perfectly with zero hassle.",
  "photos": [
    "https://images.unsplash.com/photo-1502602898657-3e91760cbb34?auto=format&fit=crop&w=600&q=80",
    "https://images.unsplash.com/photo-1530122037265-a5f1f91d3b99?auto=format&fit=crop&w=600&q=80",
    "https://images.unsplash.com/photo-1499856871958-5b9627545d1a?auto=format&fit=crop&w=600&q=80"
  ],
  "whatsapp_number": "+91 98765 43210",
  "email": "sagar.savsani@example.com",
  "verified": true,
  "featured": true,
  "active": true
}
